USER,DATE,STAR,LIKE,TITLE,REVIEW
별림이하루,2021-06-24 01:15:06-07:00,1,0,불편,정보보는거불편 다시원점이고 섹터볼때뒤로가면 다시섹터맨위로가있고 슬슬그분이 올라오기 시작함 그리고 차트는 볼때마다 계속 튕겨서 앱이 나가짐 후회중
Jularz,2021-06-21 17:40:00-07:00,4,0,주식잔고화면 버그 리포트,"특정 종목이 대여로 출고된 경우, 주식잔고 화면에서 매수버튼 비활성화되어 매수화면으로 전환 불가능

주식 주문 화면으로 바로 들어가서 해당 종목 검색하면 매수 가능함"
derugu,2021-06-17 07:26:51-07:00,3,0,아이폰11 차트 관련 개선사항,아이폰11에서 차트 가로 보기하면 ‘도구’ 아이콘이 잘려서 사용할 수 없습니다. 몇년째 불편하데 사용하다 이제야 건의합니다. 제발 개선 부탁드립니다.
백조여인,2021-06-15 07:24:39-07:00,4,0,테블릿용으로는 안만들었나요?,차트를 테블릿에서 가로로 돌려서 넓게 보고싶은데 안되나요? 방법 알려주세요 _
전역이답이다,2021-06-11 22:19:19-07:00,3,0,원래 화면 회전이 안되나요?,차트 말고는 화면이 돌아가질 않아서 불편해요
Go‼ V3!,2021-06-11 06:06:03-07:00,2,0,주식잔고 탭 정렬 좀 어떻게 안 됩니까?,"이름 오름내림차순이나, 수익률 오름내림차순 등 본인이 원하는대로 설정하는대로 정렬해서 볼 수있게는 안 됩니까?
손익률순으로 볼수는 있는데 현재가 현재가 보고 오면 다시 엉망진창 되어있고, 
장렬 기준이 뭡니까? 
주식 매수 순서도 아니고, 매입금액 높은순서도 아니고.. 
대체 이 순서는 뭘로 정합니까?
제발 정렬할 수 있게 해주세요
아니면 손익률 순서로 세팅하면, 다른탭 보고 되돌아 왔을 때 세팅한 설정 유지시켜 주시던가"
ccine,2021-06-11 05:30:36-07:00,3,0,차트 설정 버튼을 누르면 앱이 꺼져버림,수고하십니다. 차트 창에서. 우측 위에 기어모양의 설정버튼을 누르면 앱이 아예 꺼져버리는 현상이 생깁니다. 조치부탁드립니다.
아이폰 차별,2021-06-11 02:36:52-07:00,3,0,개별 종목 차트화면에서 메모 보기 기능 추가,"해당 종목에 해 놓은 메모를 보려면 너무 복잡하네요 보유종목 현재가-그룹선택-종목선택 해야 겨우 메모를 볼 수 있음
아무 메뉴에서 건 종목 차트를 눌러서 볼때 이 종목이 어떤 종목인지 메모해둔 내용을 볼 수 있도록 해주셔요"
Jun Shin12,2021-06-05 06:32:12-07:00,5,0,이체,이체 무척 편리합니다
Jang Yejun,2021-06-05 06:32:09-07:00,5,0,뉴스 굿,보유 종목 수익율을 보고서나 뉴스로 받아서 큰 도움이 됩니다
Han Hayun,2021-06-05 06:32:08-07:00,5,0,이체,이체 무척 편리합니다
뿌링클111,2021-06-04 00:48:13-07:00,2,0,메뉴 바뀐거같아요,"전엔 주식주문이랑 잔고가 하단에 고정되어있어서 편했는데 갑자기 없어졌어요ㅜ 잔고 확인 할때마다 왼쪽 메뉴에서 찾아서 들어가야해요 
이거 다시 어떻게 바꾸나요"
lotv_54,2021-06-02 18:53:51-07:00,2,0,자주 튕겨요,차트 보고 있는 중에 갑자기 앱이 종료되는 현상이 한두 번이 아닙니다. '순간'이 중요하게 여겨져야 하는 앱인만큼 오류 개선 좀 해주세요.
브로브로678,2021-06-01 21:32:53-07:00,1,0,그만 좀 해라!!!,"업데이트 할때마다 느려지냐!!!!
걍 사고 팔고 하는 간단 모드 출시하라

이러다 토스한테 시장 넘겨 준다.. 봐라!!"
보물상자,2021-05-31 19:11:52-07:00,3,1,폰트글씨를 크게 만들어주세요,다른건 모르겠고 나이가 들어 눈이 나쁜 엄마가 주식하시는데 아이폰 프로12로 새로 바꿨는데 글씨가 너무 작다고 불만 한가득이네요. 나이가 든 사람은 못하겠다며. 아이폰 내에서 폰트설정을 크게 해놔도 미래에셋증권앱 자체내 테마를 바꿔 보아도 글씨만 굵어지지 커지진 않네요. 가독성이 나이드신 분들한텐 안좋을것 같으니 다음 업데이트 때엔 꼭 반영 부탁드려요.
sneuucdns,2021-05-28 18:34:26-07:00,1,0,정말 쓰레기같은 편의성,"뭘 하나 하면 한번에 되는 법이 없음 
모바일 오티피 발급 받으려고 몇번이나 시도했는데 오늘은 신분증 확인 기관 오류라고 뜨질 않나 개같이 불편해서 빨리 털고 가고 싶은데 그것도 맘대로 못함 ㅉ"
수다맨손자,2021-05-27 23:52:46-07:00,1,0,신분증 인식률 쓰레기,"다른 어플 대비 신분증 인식하는 ai 폐급임
아이폰12프로 5월 6일날 발급한 주민등록증으로
인식하는데 10분걸림 그마저도 이름이랑 주민번호 다 틀리게 인식
그냥 손으로 치게 하세요 딴데처럼 못할거면"
Kisoo B,2021-05-25 20:16:50-07:00,5,0,좋아요,계속 사용하다보니 이젠 다른 앱 못쓰겠네요! 미래에셋 최고에요
Seohyeon Jongsoo,2021-05-25 20:16:50-07:00,5,0,잘 사용하고 있어요,편리해요~ 디자인 심플하고.. 메뉴 구성은 쫌 불만
Youngwhan Sungjin,2021-05-25 20:16:48-07:00,5,0,좋아요,주식 처음 접하는 사람들에게 유용한 앱이에요
웬만하면얀다는데,2021-05-25 19:24:31-07:00,1,0,iOS 14.6으로 업데이트하고 나서 핀번호 로그인이 안됩니다.,"홈키버튼 고장이 난 이후로 자동으로 핀번호 로그인 화면이 떴었는데, 운영체제 업데이트 이후에 생체인식이 실패했다는 화면만 뜨고 핀번호 화면이 뜨지 않아 불편함을 느낍니다."
Yun Leina,2021-05-25 08:03:46-07:00,5,0,문제 없이 사용하고 있네요,문제 없이 사용하고 있네요
재현 황,2021-05-25 08:03:44-07:00,5,0,편리해요,여러가지 다양한 정보 훌륭합니다
Seunghyun Subin,2021-05-25 07:35:59-07:00,5,0,관심종목,"관심종목이 젤 중요한데, 나름 잘 쓰고 있어요"
Qjeon Sunghyun,2021-05-25 07:35:58-07:00,5,0,사용 편해요,평소에 잘 사용하고 있습니다. 감사합니다
Mhwang Kimm,2021-05-25 07:35:57-07:00,5,0,좋아요,잘 사용하고 있어요
헤선 도33,2021-05-25 07:35:56-07:00,5,0,디자인 좋아요,유저 인터페이스나 디자인적 요소가 보기 좋고 기능도 다양하네요
Seo Seon,2021-05-25 07:35:56-07:00,5,0,매매에 도움,주식에 대한 다양한 정보를 제공해주니 매매하는 판단 기준이 되네요
하은 지,2021-05-25 07:00:00-07:00,5,0,잘 되요,주식하고 선물 거래 자주하는데 문제 없이 사용하고 있어요
영진 최 90,2021-05-25 06:59:48-07:00,5,0,굿,앱 계속 발전했으면 합니다
Boram Kwon,2021-05-25 06:59:47-07:00,5,0,개선해주세요,화면 비율 여러 디바이스에서도 잘 볼 수 있게 신경 써주세요
Ryankim Jonghun,2021-05-25 06:59:46-07:00,5,0,편리하네요,v
수민 유 88,2021-05-25 06:59:45-07:00,5,0,좋아요,여러 금융상품 조회할 수 있어서 좋습니다
Baek Jongsoo,2021-05-25 06:59:43-07:00,5,0,대박 벌자,미래에셋! 너만 믿는다~ 못 벌면 다 니탓이다
누리 제,2021-05-25 04:34:34-07:00,5,0,주식,열심히 사용할테니 제발 주식 좀 오르게 해주삼!
Cheon Lim,2021-05-25 04:34:28-07:00,5,0,굿이네요,메뉴나 화면 구성은 한눈에 보기 쉽게 되어있습니다. 자주 사용해 봐야겠어요
Yun Minha,2021-05-25 04:34:27-07:00,5,0,대기시간 길어요,고객센터에 전화해보니 친절하더군요. 대기 시간 좀 줄었으면 합니다.
Wonhee Naeun,2021-05-25 04:34:25-07:00,5,0,현황 표시,현황표시가 좀 더 빨리 뜨면 좋겠습니다.
강은 박12,2021-05-25 04:28:12-07:00,5,0,시세 설정,종목별 시세 어떻게 설정하는지 잘 모르겠습니다. 다른 건 큰 불만 없습니다.
Bomin Seungho,2021-05-25 04:28:08-07:00,4,0,평점 이상해,평점 보니 어디 주식 사라는 말은 하나도 없네
Shin Mira,2021-05-25 04:28:07-07:00,5,0,지문 인식,요즘 어플은 지문 같은 생체정보 입력하는 시스템이 많더군요.
Yejun Wonhee,2021-05-25 04:28:06-07:00,5,0,이체 편해,100만원 안되는 금액 이체할 경우 간단하게 보낼 수 있어서 편리했습니다.
경은 탁,2021-05-25 04:28:03-07:00,5,0,주식 대박,딱 이 주식만 사라고 보장해 주는 게 있으면 좋겠습니다. 없겠죠?
Jisuk Yunkyoung,2021-05-25 04:28:00-07:00,5,0,유용해요,MY홈 화면으로 맞춤 화면 만드는 건 유용하게 잘 쓰고 있습니다.
Jina Seunghyun,2021-05-25 04:27:58-07:00,5,0,좋아요,주식 어플은 매매만 잘되면 아무 문제가 없습니다.
kdndokk,2021-05-24 04:36:33-07:00,5,0,차트,차트에 일목균형표를 적용하면 스크롤이 버벅거리면서 안됩니다!!
모노비,2021-05-24 03:49:30-07:00,1,0,종목 등락 퍼센트 하나도 안맞음.,뭔가요. 실시간 반영이 하나도 안됨
왜그러는지,2021-05-20 21:41:33-07:00,1,0,이렇게 만들꺼면 그냥 없애요,문자인증요청 안와서 고객센터 연락하면 받지도 않고 카톡으로 문의해도 모든 상담사가 상담진행 중이고 일을 하고 있는건지 어플을 그지같이 만들어놔서 안해도 될 일들을 하고 있는건지 다른 증권사로 옮기는게 빠를듯요 비추합니다
지발해결좀해,2021-05-19 23:07:26-07:00,4,0,다 만족하지만 한가지 아쉬운게,"요즘 튕김현상이 좀 많은 듯 합니다
요것만 개선해주면 좋을 것 같습니다!"
준혁 전,2021-05-19 21:19:30-07:00,4,0,인증 오류 나요,가입 시 인증하는게 어려워요
Youn Yujung121,2021-05-19 20:36:16-07:00,5,0,좋아요,일단 편리하네요
반희 추,2021-05-19 20:32:24-07:00,5,0,지문 로그인,지문 로그인 해놓으니까 인증서 필요없고 접속할수 있네요
Jo Seoyoung21,2021-05-19 20:32:22-07:00,5,0,거래이체,100만원 이하 이체 거래는 진짜 간단하네요~ 기존에 보냈던 내역 누르면 편하게
명호 여,2021-05-19 20:32:20-07:00,5,0,종목별 시세,종목별로 시세를 받을 수 있다니…아주 칭찬하고 싶습니다
Yoon Jang,2021-05-19 20:32:19-07:00,5,0,맞춤화면,맞춤 화면 개인이 원하는데로 구성할 수 있네요
Yun Song121,2021-05-19 20:32:18-07:00,5,0,채권거래,채권도 거래가 가능하네요
선정 길,2021-05-19 20:32:16-07:00,5,0,좋네요,잘 쓰고 있어요~
Gwon 121,2021-05-19 20:00:44-07:00,5,0,시세 조회,스마트워치 쓰고 있는데 여기서도 시세 조회가 되네요! 신기해
Chang Baek,2021-05-19 20:00:40-07:00,5,0,감사해요,잘 만들어주셔서 감사해요
Gwon Song,2021-05-19 20:00:38-07:00,5,0,좋아요,사용하기 편리하고 주식하는데 일등 도우미!!
동윤 신12,2021-05-19 01:53:57-07:00,5,0,이체 편리,보안 매체 없이도 이체가 가능하네요
재혁 하,2021-05-19 01:25:16-07:00,5,0,지문 인증,지문만으로 로그인하니 편리한 세상이네요
Sunggon Go,2021-05-19 01:25:14-07:00,5,0,ETF 거래,ETF 거래도 가능하니 참 편리하네요
우진 모12,2021-05-19 01:25:12-07:00,5,0,좋아요,차트 화면 잘 보이네요
현정 장21,2021-05-19 01:25:11-07:00,4,0,정렬 기능,관심종목 정렬 기능이 되나요?
Ehdeoansj Jung,2021-05-19 01:25:11-07:00,5,0,굿~미래에셋,주식 매매하기 편리합니다.
Koo Sangsoo,2021-05-19 01:25:09-07:00,5,0,죠아,사용하기 쉽고 편리합니다
Yunseo Seoyun,2021-05-19 01:25:06-07:00,5,0,디자인 good~,타사 앱보다 기능도 많고 디자인도 예쁘고 자주 사용할게요
Jeon Junghwa,2021-05-19 01:25:02-07:00,5,0,디자인 깔끔해요,디자인도 깔끔하고 메뉴들 보기 좋네요
Namho Shim,2021-05-19 01:17:34-07:00,5,0,좋다,편리하게 사용하고 있습니다
Chang No 32,2021-05-19 00:53:13-07:00,5,0,잘 사용,잘 사용하고 있어요
Oh Hyesun,2021-05-18 20:30:48-07:00,5,0,좋아요 굿~,좋아요 굿~
Doyoon Song,2021-05-18 20:30:46-07:00,3,0,화면조정,화면을 조금 어둡게 할 수 있나요?
Chang Koa,2021-05-18 02:05:00-07:00,5,0,수수료 혜택,수수료 혜택도 많아서 사용하는데 만족합니다
Lee Yewon,2021-05-18 01:36:20-07:00,5,0,관심 종목,관심 종목이 실시간 반영되면 더 좋겠네요
구범 길,2021-05-18 01:36:10-07:00,5,0,좋아요,감사합니다
Jo Sangsoo,2021-05-18 01:35:49-07:00,5,0,복잡하지 않아요,복잡하지 않고 간편하게 이용할 수 있어요
Oh Yua,2021-05-18 01:34:13-07:00,5,0,수수료저렴,주식 거래하는데 수수료도 저렴해서 계속 사용하고 있어요
Jun Youngcheol,2021-05-18 01:33:43-07:00,5,0,정보 요약,정보 요약이 잘 정리되어 있어 도움이 되고 있어요
Jeon Chung,2021-05-18 01:33:34-07:00,5,0,잘쓰고있어요,주식 거래하는데 잘 쓰고 있습니다
윤서 방,2021-05-18 01:33:21-07:00,5,0,관심종목,관심 종목 조회 기능 보는 것 편하게 되어 있어요
zsggheqfvnh,2021-05-18 00:11:27-07:00,1,0,불편,"정말 많이불편함
이해 불가
타사에 비해 불편 그자체"
만타렝,2021-05-17 17:15:09-07:00,1,0,자꾸 강제종료되요,몇번을 다시 로그인하게 됨 짜증나요 쓸수가 없음. 특히 최근 상장한 종목 클릭하면 무조건 종료. 테스트 좀 하고 릴리즈해요
waterman do,2021-05-15 22:25:02-07:00,4,0,아이패드 전용 앱 출시 요청,아이패드 전용 앱 출시 요청
또너양,2021-05-13 00:28:26-07:00,3,0,번호인증이 안됩니다,통신사오류라고 떠요
깡총이딸아빠,2021-05-13 00:06:26-07:00,1,0,앱 로딩 속도가 왜이럼????,"수정 좀 하세요 ㅡㅡ
해외꺼는 안그런데
아씨 진짜 안들어가져서 다 놓쳤다"
치맥가이,2021-05-12 20:58:05-07:00,1,0,왜 계좌송금이 안돼요?,"오티피 눌르래서 누르고 확인눌렀는데
뭐 안되면 메세지라도 띄우던지
창만 초기화되고 잔액은 그대로고.. 뭐하자는겁니까?"
권리는 지켜주세요,2021-05-12 20:29:52-07:00,1,0,투표할 권리는 지켜주세요,"투표할 권리는 주주로서 마땅히 행사할수 있는 권리 입니다. 
5월 7일 약 11시 다른 지인에게 온 의결권 행사 안내 문자는 똑같은 주주인 저에게 오지 않았고, 고객센터는 항상 최소 40분기다려야지 사람하고 연결이 됩니다. (심지어 1588번호) 

의결권 행사하고 싶다고 말씀 드리니까 다시 전화를 준다하고 지인은 1시간 내로 받은 전화 저는 지금 24시간 넘게 못받고 있습니다. 심지어 카톡 상담사도 연결 안됩니다. 참고로 전 주식 대여 서비스도 신청 안되있습니다. 

방법을 알아보니 결국 그냥 이메일로 서류를 제출하는건데 웹사에트에 공지로 띄울수있는걸 미래에셋 측에선 실질적으로 투표를 불가능하게 만들고 있습니다

1. 문자도 안주시고 (미래에셋으로 투표 하는 방법과 기간을 제가 직접 물어봐가면서 알아냈습니다. 말이 됩니까?) 
2. 전화도 안받으시고 (고객센터 전화하면 항상 40분 이상 기다려야합니다)
3. 준다는 전화도 안주시고 (남이 1시간내로 받은 전화 24시간째 못받고있습니다)
4. 카톡도 연결 안됩니다.

장난합니까 지금? 투표 한번 하는게 이렇게 번거로울 필요가 있나요?"
띨민,2021-05-12 19:33:42-07:00,5,0,태블릿용,아이패드에도 맞게 만들어주시면 안될까요?
별명때문에리뷰10만번째반복중,2021-05-12 15:16:31-07:00,1,0,어플 실행 할 때마다 업데이트 하란 메시지 정말 짜증나서 증권사 옮겨야 할 듯,개짜증
Chungbok Lee,2021-05-10 19:37:48-07:00,1,0,아 앱 진짜 느리고 구려요,놓치면 안될 시스템 피드백 알림은 왜 도대체 나왔다 사라지는데… 모달로 그냥 띄워놓게 하지 ㅠㅠ
ㅎㅎㅎㅎ호잇,2021-05-10 18:28:04-07:00,1,0,어플 너무 불편해요,다른 주식 어플들도 다 쓰는데 비교해봤을 때 제일 불편해요.
갱이지용,2021-05-10 17:32:15-07:00,1,0,"관심그룹,최근종목이 다 0으로떠요",로그아웃해도이러는데 어플지우고 다시깔아도 문제없나요?
우ㅡㅁ하핳,2021-05-10 17:05:31-07:00,3,0,정정주문,"정정 취소주문이 안되요ㅠㅠㅠㅠㅠㅠ
안드로이드는 잘되었는데"
heratoss,2021-05-10 15:38:28-07:00,1,0,업데이트 최악,"얼마나 개판이면 매번 업데이트. 짱남 
좀모아서 업데이트해라"
경굥굥굥,2021-05-10 15:24:24-07:00,4,0,다 좋은데,"추세선이나 기준선 그리는게 차트마다 적용이 안되요 ㅠㅠ
추세선 그리는 것도 너무 불편하구요 다른거는 다 차트마다 저장되는데 ㅠㅠ 그게너무불편해요"
jadu***,2021-05-09 21:58:58-07:00,1,0,계속로그인안되고 환쟝,"왜이러나요~저만그런건지
계속 뱅글뱅글돌기만하고
죽긋네요
빨리 타사로옮겨야하는데
암튼비추"
개미...,2021-05-09 21:28:39-07:00,1,0,뭣같다증말,업데이트를 해도 접속 장애도 자주 되고 오늘은 특히 종목알리미->현재가 알림 작성하는데 계속 먹통으로 금액 기록도 안되고 증말 이럴거니. 에휴 답 없다. 고객이 이동하는수밖에.
이혜미0120,2021-05-09 03:39:27-07:00,2,0,아나,뭘 맨날 업뎃하래짜증나게ㅡㅡ
율이깰라,2021-05-07 08:23:23-07:00,5,0,아이패드용,아이폰에서 잘쓰고 있습니다. 하지만 아이패드 전용앱은 없나요? 아이폰용하고 레이아웃이 똑같네요…
종목 많은 사용자,2021-05-07 03:34:44-07:00,3,0,주식 잔고 화면,주식 잔고 화면에서 소팅 선택한 대로 다른 화면을 갔다오거나 재로그인 하더라도 남아있었으면 좋겠습니다.
쑤쑤우우우우우우우,2021-05-06 21:20:10-07:00,2,0,이체가 안되요.,"OTP 번호 입력 이후부터 진행이 안됩니다.
 이체 가능하게 조치 부탁드립니다."
쭈유우우웅,2021-05-06 17:04:22-07:00,3,0,계좌등록,온라인 미약정 계좌라고 나오는데 해결방법을 못찾겠네요..
hollywiz,2021-05-05 18:46:56-07:00,1,0,관심종목창에서 각 종목의 현재가가 반영되지 않습니다.,"관심종목창에서 각 종목의 현재가가 반영되지 않습니다.
빨리 수정 해 주세요."
gongjusubang,2021-05-04 03:57:10-07:00,1,0,증권사 어플들 중 가장 최악의 어플,여러 증권사 어플 쓰고 있지만 otp발급부터 시작해서 모든게 최악이네요
제발써져라,2021-05-04 00:18:49-07:00,1,0,진짜 이런 똥같은어플을 봣나,비밀번호 설정하라고 해서 설정했더니 지멋대로 오류나서 5회락 걸렸네요 진짜 어플 상당히 맘에 안듬 종로 고객지원센터? 거기도 여직원들 그렇게 일하시면 돈을 받을순있는걸까요? 너무 어이가없고 어플 사용하지말아야겠습니다  저같은 피해자분들이 또생기면 안되니 꼭 참고하세요
ㅁㅇㅁㄴㅁ,2021-05-02 23:43:10-07:00,1,0,개같은,역대 최악의 증권앱 그냥 회사 운영하지마세요 쓰레기같으니까 ㅈ같이 만들어놨네
iikkkjkkkk,2021-04-30 16:21:40-07:00,4,0,예약 매수매도는 정정 및 취소가 안되나요?,예약 매수 혹은 매도는 정정 및 취소가 안되나요?
상큐몽,2021-04-30 00:56:01-07:00,1,0,개인 배당 물량 줄이는 배부른,5/3 어플삭제
리얼 ㅋㅋㅋ,2021-04-30 00:14:56-07:00,1,0,업데이트,오류 ㅈ나나고 진짜 가지가지한다 ㅋㅋ
하야추니,2021-04-28 22:37:37-07:00,1,0,운영을 이딴식으로 하네,개같은 것들이 고객센터 전화했더니 무슨 문의량이 많아서 잠시후 다시 걸어달라는 ARS와 함께 끊어지네ㅋㅋㅋㅋㅋ 잠시후에하면 뭐 문의가 없냐? 채팅 상담 눌러도 문의량이 많아서 채팅상담 불가하다고 나오면서 무슨 운영을 이딴식으로 해 거긴 직원도 안뽑냐? 이딴식으로할거면 고객센터를 왜 만듦? 진짜 운영 ㅈ같이하네
나옹님s,2021-04-28 21:51:48-07:00,1,0,별 하나도 아까움,주식으로 돈 날리고 싶으면 이 어플쓰세요 로그인부터 이체 채우기 공모주 otp발급까지 제대로 되는게 하나도 없음 금융어플을 이따위로 만들어서 손해보게 만들고 보상도 없고 두 번 다신 안씁니다.
Nam Sangho,2021-04-28 07:58:04-07:00,5,0,별점 후하게 쏩니다,별점 후하게 쏩니다 ㅋ 대박나게 해주세요
여진 금,2021-04-28 07:57:57-07:00,5,0,게임하고 금방 실행시키면,게임 하다가 끄고 금방 실행시키면 배터리가 뜨거워서 그런지 로딩이 길어요 ㅠ 폰이 구려서 그런가
Go Changyoung,2021-04-28 07:33:09-07:00,5,0,고수추천 필요,미래에셋 맘에 들어서 잘쓰고 있는데 고수들의 종목추천 같은거 준비되면 좋겠네요
크케크,2021-04-27 06:24:29-07:00,1,0,븅신같은 신분증 인식으로 인증시키지마라,"야이 븅신들아
신분증 인식을 니미 똥대로 해놓고
몇번 반복 시키는거냐
제대로 쳐 만들고 시키던가
개 븅신들같네"
하핳ㅋㅋㅋ,2021-04-26 22:44:32-07:00,1,0,신분증 인식 그냥 안됨,개발자들이 발로 만들었나
비비부부바바,2021-04-26 16:53:30-07:00,1,0,앱좀 똑바로..,"폰 바꾸고 생체인증 다시 했더니 
갑자기 생체인증 다 풀리고 다시 등록하라함
등록하는 중에 계좌비번 입력하는데 계속 틀렸다해서 
5회실패러 아무것도 안됨
매일 입력하고 수익률 확인하던 비번인데 
내가 틀렸을리 있냐구요ㅠㅜ
지점 갈때까지 내돈 묶여서 암것도 못하고안그래도 개설할따 모바일 otp안해서 그뒤로 계속 개설 안되고 출금도 카뱅으로 하고 있구먼 
이따위로 만들지 마세요
지점갈때까지 제돈 마이너스 나면 보상합니까
너무 열받네요 그동안 진짜 참다 폭발
지점 갔다오면 다 출금할거임"
ㅏ탸ㅏㅐ,2021-04-26 08:02:54-07:00,1,0,계좌개설,민증 인식을 할 생각을 인하네요 다른 어플들은 똑같이 찍어서 한번에 통과했는데 안되면 안된다는 표시라도 나오던지 해야지 끝없이 로딩만 하몀 뭐 어쩌라는거;
프로지적러,2021-04-26 02:01:34-07:00,1,0,모바일 OTP,아니 도대체 이거는 왜 안되는건지 이해가 안되네요 계좌 개설한지가 한달이 넘었는데 왜 안넘어가지나요 어플좀 업데이트좀 합시다..
아우라~,2021-04-25 22:11:11-07:00,1,0,봉개수 설정 이거 왜 자꾸 초기화되죠?,업데이트하고 나서 자꾸 이렇네요. 다른 메뉴 눌렀다가 차트 누르면 봉개수 설정해놓은게 다시 초기화되네요
good@@!!,2021-04-25 21:35:09-07:00,3,0,종합차트볼때,"어느정도 확대한상태로 종합차트볼때 좌우로 스크롤하는게 잘 안되던데 저만그런가요?
현재가에서 차트들어가면 이동 잘 되는데 하단에있는 종합차트에서는 스크롤이 잘 안되네요ㅠㅠ"
Yu Nam 342,2021-04-24 00:53:16-07:00,5,0,기본화면 변경 기능,기본화면에서 지수 시세 환율 같은 순서 바꿀 수 잇어요
정웅 최,2021-04-24 00:53:08-07:00,5,0,여러 앱 중 괜찮음,주식 어플 여러 개 써봤는데 최고는 아니지만 그래도 제일 낫네요
Baek Youngha,2021-04-24 00:52:38-07:00,5,0,기능 추가 요청,주식 어플 여러 개 써봤는데 최고는 아니지만 그래도 제일 낫네요
나리 추,2021-04-24 00:52:22-07:00,5,0,남들은 다 오르는데,남들은 다 오르는데 난 왜 떨어지지 ㅠㅠ
Suh Banhee,2021-04-24 00:51:49-07:00,5,0,기능이 많네요,정말 다양한 기능이 많이 지원돼서 좋아요
Min Hong 32,2021-04-24 00:51:11-07:00,5,0,업종 차트 비교,업종 차트 비교해보셨나요? 이렇게 매매하는 게 편리해요
Nam No 34,2021-04-24 00:50:51-07:00,5,0,관심종목 확인 기능,전 관심종목 확인 기능을 많이 쓰는데 그게 잘 되어 있어요
helloevery1nice,2021-04-23 03:40:00-07:00,3,0,뒤로가기 제스처 좀 적용해 주세요,"my홈에서 종목뉴스와 주요뉴스 잘 사용하고 있습니다. 그런데 기사를 보고 뉴스 목록으로 돌아갈 때마다 상단 화살표를 눌러야해서 너무 불편하네요. 애플의 기본 제스처인데 기사글 같은 곳은 적용 됐으면 좋겠습니다.

+ ios14.5 지수종합형 지수타일형 모두 종목 편집이 안되네요..."
wbdjakz,2021-04-21 03:39:56-07:00,1,0,별로...,"계좌 개설 앱이랑 주식 거래 앱을 분리해 놓은 게 참 마음에 안 드네요
괜히 설치 두 번 해야되고 시간은 시간대로 오래 걸리고 마음에 안 들어요~"
꼬,2021-04-20 20:41:03-07:00,3,0,아이폰 스와이프 뒤로가기 해주세요,대부분의 아이폰 앱에 스와이프로 뒤로가기기능이 들어있는데 요건 없네요ㅜㅜ 불편해요 개선해주세요~~!
은행 바꾼다,2021-04-20 08:57:00-07:00,1,0,생체 접속 오류,여기 좀 쓰기 위험하네요 이러다 돈날려 먹을것 같아 제가 타사꺼 분산 투자중인데 이 앱 문제다 많아 보임 접속이 잘안됨 생체는 왜 오류가 계속나는건지 분명 폰이상이면 잠금도 생체인데 안되어야 하는데 엄청 잘되거든요
Radiogoo,2021-04-19 19:06:48-07:00,3,0,관심종목의 그룹 삭제가 힘드네요,"구룹삭제하려고 x 를 터치하면 열에 한번 성공하까 하네여.   
ㅜㅜ."
